[
  {
    "task_id": "auth-login-tests",
    "dedupe_key": "auth-login-tests",
    "mode": "execute",
    "prompt": "为登录模块补 Vitest；约束：npm run check && npm test 必须通过。",
    "acceptance_criteria": "npm test 含登录相关用例且全部通过",
    "priority": 1
  },
  {
    "task_id": "refactor-queue-helper",
    "dedupe_key": "refactor-queue-helper",
    "mode": "plan",
    "prompt": "分析队列相关 helper 中的重复逻辑，给出重构方案与文件级变更清单；本任务不写代码，仅输出计划。",
    "priority": 0
  }
]
